{
  "admission": "inert",
  "deliverableForm": "product-launch-video",
  "jobId": "motion-graphics",
  "kernel": [
    "foundation",
    "toolchain"
  ],
  "next": [
    {
      "action": "check",
      "command": "foundation",
      "required": true,
      "role": "kernel"
    },
    {
      "action": "resolve",
      "command": "toolchain",
      "required": true,
      "role": "kernel"
    },
    {
      "action": "route",
      "command": "iart",
      "required": true,
      "role": "primary"
    }
  ],
  "planSha256": "6326eeb981dbaff14eec44375511b5000295b6393e7c9b5a4cbf87569768f90a",
  "primaryKnowledge": {
    "action": "route",
    "admission": "inert",
    "command": "iart",
    "id": "iart"
  },
  "query": "宣传片配乐检查：响度、真峰值、削波、静音、音乐进出点和版权许可",
  "registrySha256": "fe12e43bc11e5b795d36bb476a1019b3803b1310300e7271b73aa94cb726b17c",
  "routeSha256": "87d4b8420bccc3939fe9120471a49edf8587122398160a2297bfe35db7d9bcee",
  "schema": "design-pipeline.job-plan.v1",
  "secondaries": []
}
