{
  "admission": "inert",
  "deliverableForm": "product-launch-video",
  "jobId": "motion-graphics",
  "kernel": [
    "foundation",
    "toolchain"
  ],
  "next": [
    {
      "action": "check",
      "command": "foundation",
      "required": true,
      "role": "kernel"
    },
    {
      "action": "resolve",
      "command": "toolchain",
      "required": true,
      "role": "kernel"
    },
    {
      "action": "route",
      "command": "iart",
      "required": true,
      "role": "primary"
    }
  ],
  "planSha256": "8900639aaf0b3e65e0f3a225ebcf2d62480f0caafe066541b362033ef836393d",
  "primaryKnowledge": {
    "action": "route",
    "admission": "inert",
    "command": "iart",
    "id": "iart"
  },
  "query": "用 Strudel 代码作曲给宣传片配乐，并让剪辑卡在音乐网格上",
  "registrySha256": "fe12e43bc11e5b795d36bb476a1019b3803b1310300e7271b73aa94cb726b17c",
  "routeSha256": "fbc07f404a8118e2eb708f77a5a294ecbce1b3b33dc8101a5bb72b03ef4c4fa0",
  "schema": "design-pipeline.job-plan.v1",
  "secondaries": []
}
