{
  "admission": "inert",
  "deliverableForm": "product-launch-video",
  "jobId": "motion-graphics",
  "kernel": [
    "foundation",
    "toolchain"
  ],
  "next": [
    {
      "action": "check",
      "command": "foundation",
      "required": true,
      "role": "kernel"
    },
    {
      "action": "resolve",
      "command": "toolchain",
      "required": true,
      "role": "kernel"
    },
    {
      "action": "route",
      "command": "iart",
      "required": true,
      "role": "primary"
    }
  ],
  "planSha256": "c4273413cfb834a4482ccd488e850e3c154bce8aaff4ba6f14947e9d8ccbd36e",
  "primaryKnowledge": {
    "action": "route",
    "admission": "inert",
    "command": "iart",
    "id": "iart"
  },
  "query": "用 Blender 渲染真实 3D 产品镜头并接入宣传片检查",
  "registrySha256": "fe12e43bc11e5b795d36bb476a1019b3803b1310300e7271b73aa94cb726b17c",
  "routeSha256": "c4a436b616d9a2e76911e526a97b4deea33bd0259b4a8edfb320fc1816d94a75",
  "schema": "design-pipeline.job-plan.v1",
  "secondaries": []
}
