{
  "admission": "inert",
  "deliverableForm": "product-launch-video",
  "jobId": "motion-graphics",
  "kernel": [
    "foundation",
    "toolchain"
  ],
  "next": [
    {
      "action": "check",
      "command": "foundation",
      "required": true,
      "role": "kernel"
    },
    {
      "action": "resolve",
      "command": "toolchain",
      "required": true,
      "role": "kernel"
    },
    {
      "action": "route",
      "command": "iart",
      "required": true,
      "role": "primary"
    }
  ],
  "planSha256": "0df6e1c7c06aace435e080b72129a51bd8faa0626fc8d0aefa5f63fe0df50177",
  "primaryKnowledge": {
    "action": "route",
    "admission": "inert",
    "command": "iart",
    "id": "iart"
  },
  "query": "给我们的画布做一个宣传动画，用 HTML 页面播放，让人想用它。",
  "registrySha256": "fe12e43bc11e5b795d36bb476a1019b3803b1310300e7271b73aa94cb726b17c",
  "routeSha256": "805f8d26f1a1909705c6c4d38c2ce7ed51d43d6bb6b658525f193fcf9aff68d4",
  "schema": "design-pipeline.job-plan.v1",
  "secondaries": []
}
