{
  "admission": "inert",
  "deliverableForm": "product-launch-video",
  "jobId": "motion-graphics",
  "kernel": [
    "foundation",
    "toolchain"
  ],
  "next": [
    {
      "action": "check",
      "command": "foundation",
      "required": true,
      "role": "kernel"
    },
    {
      "action": "resolve",
      "command": "toolchain",
      "required": true,
      "role": "kernel"
    },
    {
      "action": "route",
      "command": "iart",
      "required": true,
      "role": "primary"
    }
  ],
  "planSha256": "846b5569cfcc90feb59efeaad9fc4e9fa0a3fac3eaabb06b1a31a65b5df47a36",
  "primaryKnowledge": {
    "action": "route",
    "admission": "inert",
    "command": "iart",
    "id": "iart"
  },
  "query": "HTML product launch video for SeedController ASCII canvas AI image video workflows",
  "registrySha256": "6722b06d9f9a37fd64eebfe68ec8831724664b15089d679f1dad6bfff1a56b9e",
  "routeSha256": "2afcccfc715f342b20ee7c161eee7571811c1600f0bee5a781fb4b689db47b73",
  "schema": "design-pipeline.job-plan.v1",
  "secondaries": []
}
