{
  "admission": "inert",
  "deliverableForm": "product-launch-video",
  "jobId": "motion-graphics",
  "kernel": [
    "foundation",
    "toolchain"
  ],
  "next": [
    {
      "action": "check",
      "command": "foundation",
      "required": true,
      "role": "kernel"
    },
    {
      "action": "resolve",
      "command": "toolchain",
      "required": true,
      "role": "kernel"
    },
    {
      "action": "route",
      "command": "iart",
      "required": true,
      "role": "primary"
    }
  ],
  "planSha256": "7a0becca2523e6d713d8c45df241be86dffd88565b16fb303647d5bb4d049f14",
  "primaryKnowledge": {
    "action": "route",
    "admission": "inert",
    "command": "iart",
    "id": "iart"
  },
  "query": "参考样片的样式和感觉，为我们的画布做一个新的宣传动画，HTML 页面播放并配乐",
  "registrySha256": "fe12e43bc11e5b795d36bb476a1019b3803b1310300e7271b73aa94cb726b17c",
  "routeSha256": "ffb110e72496724da9fdcb1c1270988ddfcfba91e2b00bf09236e72007e29c4f",
  "schema": "design-pipeline.job-plan.v1",
  "secondaries": []
}
